{
  "schema_version": "1.0.0",
  "generated_at": "2026-10-18T22:02:56+09:00",
  "hub_name": "PROVE Global Data Hub",
  "feeds": [
    {
      "feed_id": "macro_scores",
      "filename": "macro_scores.json",
      "title_ja": "マクロ経済スコア（進出魅力度・為替・インフレ）",
      "title_en": "Macro scores (attractiveness, FX, inflation)",
      "phase": "1",
      "status": "active",
      "last_updated": "2026-10-18T22:02:54+09:00",
      "source": {
        "label": "World Bank",
        "url": "https://data.worldbank.org/",
        "license": "CC BY 4.0"
      },
      "schema_version": "1.0.0",
      "update_cadence": "monthly",
      "modules": [
        "A1",
        "A2",
        "A3"
      ]
    },
    {
      "feed_id": "trade_flows",
      "filename": "trade_flows.json",
      "title_ja": "日本の品目別・相手国別 貿易フロー",
      "title_en": "Japan trade flows by HS and partner",
      "phase": "2",
      "status": "active",
      "last_updated": "2026-10-18T22:02:56+09:00",
      "source": {
        "label": "UN Comtrade",
        "url": "https://comtradeplus.un.org/"
      },
      "schema_version": "1.0.0",
      "update_cadence": "monthly",
      "modules": [
        "E3"
      ]
    },
    {
      "feed_id": "jp_affiliates",
      "filename": "jp_affiliates.json",
      "title_ja": "日系海外現地法人（国別）",
      "title_en": "Japanese overseas affiliates by country",
      "phase": "2",
      "status": "active",
      "last_updated": "2026-10-18T22:02:56+09:00",
      "source": {
        "label": "経産省 海外事業活動基本調査（e-Stat・Excel参考表）",
        "url": "https://www.e-stat.go.jp/stat-search/files?toukei=00550120"
      },
      "schema_version": "1.0.0",
      "update_cadence": "annual",
      "modules": [
        "C1"
      ],
      "note_ja": "第54回（2023年度実績）企業数（国別）本番化済・19ヶ国。e-Stat getStatsList API非対応のためExcel半自動取込（毎年1回・人手でstatInfId確認要）。売上高（国別）は本表未収録のためnull。"
    },
    {
      "feed_id": "market_matrix",
      "filename": "market_matrix.json",
      "title_ja": "業種×国 市場マトリクス",
      "title_en": "Industry × country market matrix",
      "phase": "2",
      "status": "active",
      "last_updated": "2026-10-18T22:02:56+09:00",
      "source": {
        "label": "Atlas DataLake market-grid（事実品質ゲート適用）"
      },
      "schema_version": "1.0.0",
      "update_cadence": "quarterly",
      "modules": [
        "B1",
        "B2"
      ],
      "note_ja": "B1: 医療機器×7か国のみ先行公開（7セル・事実品質ゲート通過分のみ）。他業種は集計値転用のため保留。B2は未着手。"
    }
  ]
}
